Reading OpenROAD database at '/home/gmun/Downloads/Sin_Corregir/runs/mult8_2bits_1op_e17298/61-openroad-globalrouting/mult8_2bits_1op_e17298.odb'…
Reading library file at '/home/gmun/.volare/volare/sky130/versions/0fe599b2afb6708d281543108caf8310912f54af/sky130A/libs.ref/sky130_fd_sc_hd/lib/sky130_fd_sc_hd__tt_025C_1v80.lib'…
Reading design constraints file at '/nix/store/ss2cw3sxbrwwx9jl0rrppbw4kgcmgi2n-python3-3.11.9-env/lib/python3.11/site-packages/openlane/scripts/base.sdc'…
[WARNING STA-0366] port '__VIRTUAL_CLK__' not found.
[INFO] Using clock __VIRTUAL_CLK__…
[INFO] Setting output delay to: 2
[INFO] Setting input delay to: 2
[WARNING STA-0366] port '__VIRTUAL_CLK__' not found.
[INFO] Setting load to: 0.033442
[INFO] Setting clock uncertainty to: 0.25
[INFO] Setting clock transition to: 0.1499999999999999944488848768742172978818416595458984375
[WARNING STA-0419] transition time can not be specified for virtual clocks.
[INFO] Setting timing derate to: 5%
[WARNING STA-0450] virtual clock __VIRTUAL_CLK__ can not be propagated.
[WARNING STA-0450] virtual clock __VIRTUAL_CLK__ can not be propagated.
[INFO] Setting signal min routing layer to: met1 and clock min routing layer to met1. 
[INFO] Setting signal max routing layer to: met5 and clock max routing layer to met5. 
-congestion_iterations 50 -verbose
[INFO GRT-0020] Min routing layer: met1
[INFO GRT-0021] Max routing layer: met5
[INFO GRT-0022] Global adjustment: 30%
[INFO GRT-0023] Grid origin: (0, 0)
[INFO GRT-0043] No OR_DEFAULT vias defined.
[INFO GRT-0088] Layer li1     Track-Pitch = 0.4600  line-2-Via Pitch: 0.3400
[INFO GRT-0088] Layer met1    Track-Pitch = 0.3400  line-2-Via Pitch: 0.3400
[INFO GRT-0088] Layer met2    Track-Pitch = 0.4600  line-2-Via Pitch: 0.3500
[INFO GRT-0088] Layer met3    Track-Pitch = 0.6800  line-2-Via Pitch: 0.6150
[INFO GRT-0088] Layer met4    Track-Pitch = 0.9200  line-2-Via Pitch: 1.0400
[INFO GRT-0088] Layer met5    Track-Pitch = 3.4000  line-2-Via Pitch: 3.1100
[INFO GRT-0019] Found 0 clock nets.
[INFO GRT-0001] Minimum degree: 2
[INFO GRT-0002] Maximum degree: 11
[INFO GRT-0003] Macros: 0
[INFO GRT-0043] No OR_DEFAULT vias defined.
[INFO GRT-0004] Blockages: 65

[INFO GRT-0053] Routing resources analysis:
          Routing      Original      Derated      Resource
Layer     Direction    Resources     Resources    Reduction (%)
---------------------------------------------------------------
li1        Vertical            0             0          0.00%
met1       Horizontal      16240          8019          50.62%
met2       Vertical        12152          7810          35.73%
met3       Horizontal       8120          5446          32.93%
met4       Vertical         4928          2977          39.59%
met5       Horizontal       1624           729          55.11%
---------------------------------------------------------------

[INFO GRT-0197] Via related to pin nodes: 1748
[INFO GRT-0198] Via related Steiner nodes: 33
[INFO GRT-0199] Via filling finished.
[INFO GRT-0111] Final number of vias: 2180
[INFO GRT-0112] Final usage 3D: 7665

[INFO GRT-0096] Final congestion report:
Layer         Resource        Demand        Usage (%)    Max H / Max V / Total Overflow
---------------------------------------------------------------------------------------
li1                  0             0            0.00%             0 /  0 /  0
met1              8019           576            7.18%             0 /  0 /  0
met2              7810           549            7.03%             0 /  0 /  0
met3              5446             0            0.00%             0 /  0 /  0
met4              2977             0            0.00%             0 /  0 /  0
met5               729             0            0.00%             0 /  0 /  0
---------------------------------------------------------------------------------------
Total            24981          1125            4.50%             0 /  0 /  0

[INFO GRT-0018] Total wirelength: 12647 um
[INFO GRT-0014] Routed nets: 336
[INFO GRT-0006] Repairing antennas, iteration 1.
[INFO GRT-0043] No OR_DEFAULT vias defined.
[INFO GRT-0012] Found 1 antenna violations.
[INFO GRT-0015] Inserted 1 diodes.
[INFO GRT-0009] rerouting 77 nets.
[INFO GRT-0001] Minimum degree: 2
[INFO GRT-0002] Maximum degree: 11
[INFO GRT-0006] Repairing antennas, iteration 2.
[INFO GRT-0043] No OR_DEFAULT vias defined.
[INFO GRT-0012] Found 0 antenna violations.
Placement Analysis
---------------------------------
total displacement          0.0 u
average displacement        0.0 u
max displacement            0.0 u
original HPWL            7671.3 u
legalized HPWL           7674.0 u
delta HPWL                    0 %

[INFO DPL-0020] Mirrored 122 instances
[INFO DPL-0021] HPWL before            7674.0 u
[INFO DPL-0022] HPWL after             7469.0 u
[INFO DPL-0023] HPWL delta               -2.7 %
-congestion_iterations 50 -verbose
[INFO GRT-0020] Min routing layer: met1
[INFO GRT-0021] Max routing layer: met5
[INFO GRT-0022] Global adjustment: 30%
[INFO GRT-0023] Grid origin: (0, 0)
[INFO GRT-0043] No OR_DEFAULT vias defined.
[INFO GRT-0088] Layer li1     Track-Pitch = 0.4600  line-2-Via Pitch: 0.3400
[INFO GRT-0088] Layer met1    Track-Pitch = 0.3400  line-2-Via Pitch: 0.3400
[INFO GRT-0088] Layer met2    Track-Pitch = 0.4600  line-2-Via Pitch: 0.3500
[INFO GRT-0088] Layer met3    Track-Pitch = 0.6800  line-2-Via Pitch: 0.6150
[INFO GRT-0088] Layer met4    Track-Pitch = 0.9200  line-2-Via Pitch: 1.0400
[INFO GRT-0088] Layer met5    Track-Pitch = 3.4000  line-2-Via Pitch: 3.1100
[INFO GRT-0019] Found 0 clock nets.
[INFO GRT-0001] Minimum degree: 2
[INFO GRT-0002] Maximum degree: 11
[INFO GRT-0003] Macros: 0
[INFO GRT-0043] No OR_DEFAULT vias defined.
[INFO GRT-0004] Blockages: 65

[INFO GRT-0053] Routing resources analysis:
          Routing      Original      Derated      Resource
Layer     Direction    Resources     Resources    Reduction (%)
---------------------------------------------------------------
li1        Vertical            0             0          0.00%
met1       Horizontal      16240          8019          50.62%
met2       Vertical        12152          7810          35.73%
met3       Horizontal       8120          5446          32.93%
met4       Vertical         4928          2977          39.59%
met5       Horizontal       1624           729          55.11%
---------------------------------------------------------------

[INFO GRT-0197] Via related to pin nodes: 1748
[INFO GRT-0198] Via related Steiner nodes: 33
[INFO GRT-0199] Via filling finished.
[INFO GRT-0111] Final number of vias: 2180
[INFO GRT-0112] Final usage 3D: 7666

[INFO GRT-0096] Final congestion report:
Layer         Resource        Demand        Usage (%)    Max H / Max V / Total Overflow
---------------------------------------------------------------------------------------
li1                  0             0            0.00%             0 /  0 /  0
met1              8019           577            7.20%             0 /  0 /  0
met2              7810           549            7.03%             0 /  0 /  0
met3              5446             0            0.00%             0 /  0 /  0
met4              2977             0            0.00%             0 /  0 /  0
met5               729             0            0.00%             0 /  0 /  0
---------------------------------------------------------------------------------------
Total            24981          1126            4.51%             0 /  0 /  0

[INFO GRT-0018] Total wirelength: 12654 um
[INFO GRT-0014] Routed nets: 336
[INFO] Setting RC values…
Setting global connections for newly added cells…
[INFO] Setting global connections...
Updating metrics…
Cell type report:                       Count       Area
  Fill cell                               130     487.97
  Tap cell                                469     586.81
  Antenna cell                              1       2.50
  Timing Repair Buffer                     70     600.58
  Inverter                                  7      26.28
  Multi-Input combinational cell          243    2023.19
  Total                                   920    3727.32
Writing OpenROAD database to '/home/gmun/Downloads/Sin_Corregir/runs/mult8_2bits_1op_e17298/64-openroad-repairantennas/1-diodeinsertion/mult8_2bits_1op_e17298.odb'…
Writing layout to '/home/gmun/Downloads/Sin_Corregir/runs/mult8_2bits_1op_e17298/64-openroad-repairantennas/1-diodeinsertion/mult8_2bits_1op_e17298.def'…
