Reading OpenROAD database at '/home/gmun/Downloads/2Bits2op/runs/e7_SARSA_nSteps_INDEPENDIENTES/69-openroad-repairantennas/1-diodeinsertion/e7_SARSA_nSteps_INDEPENDIENTES.odb'…
Reading library file at '/home/gmun/.volare/volare/sky130/versions/0fe599b2afb6708d281543108caf8310912f54af/sky130A/libs.ref/sky130_fd_sc_hd/lib/sky130_fd_sc_hd__tt_025C_1v80.lib'…
Reading design constraints file at '/nix/store/ss2cw3sxbrwwx9jl0rrppbw4kgcmgi2n-python3-3.11.9-env/lib/python3.11/site-packages/openlane/scripts/base.sdc'…
[WARNING STA-0366] port '__VIRTUAL_CLK__' not found.
[INFO] Using clock __VIRTUAL_CLK__…
[INFO] Setting output delay to: 2
[INFO] Setting input delay to: 2
[WARNING STA-0366] port '__VIRTUAL_CLK__' not found.
[INFO] Setting load to: 0.033442
[INFO] Setting clock uncertainty to: 0.25
[INFO] Setting clock transition to: 0.1499999999999999944488848768742172978818416595458984375
[WARNING STA-0419] transition time can not be specified for virtual clocks.
[INFO] Setting timing derate to: 5%
[WARNING STA-0450] virtual clock __VIRTUAL_CLK__ can not be propagated.
[INFO ORD-0030] Using 4 thread(s).
[INFO DRT-0149] Reading tech and libs.
[WARNING DRT-0349] LEF58_ENCLOSURE with no CUTCLASS is not supported. Skipping for layer mcon
[WARNING DRT-0349] LEF58_ENCLOSURE with no CUTCLASS is not supported. Skipping for layer mcon
[WARNING DRT-0349] LEF58_ENCLOSURE with no CUTCLASS is not supported. Skipping for layer via
[WARNING DRT-0349] LEF58_ENCLOSURE with no CUTCLASS is not supported. Skipping for layer via
[WARNING DRT-0349] LEF58_ENCLOSURE with no CUTCLASS is not supported. Skipping for layer via2
[WARNING DRT-0349] LEF58_ENCLOSURE with no CUTCLASS is not supported. Skipping for layer via2
[WARNING DRT-0349] LEF58_ENCLOSURE with no CUTCLASS is not supported. Skipping for layer via3
[WARNING DRT-0349] LEF58_ENCLOSURE with no CUTCLASS is not supported. Skipping for layer via3
[WARNING DRT-0349] LEF58_ENCLOSURE with no CUTCLASS is not supported. Skipping for layer via4
[WARNING DRT-0349] LEF58_ENCLOSURE with no CUTCLASS is not supported. Skipping for layer via4

Units:                1000
Number of layers:     13
Number of macros:     441
Number of vias:       29
Number of viarulegen: 25

[INFO DRT-0150] Reading design.

Design:                   e7_SARSA_nSteps_INDEPENDIENTES
Die area:                 ( 0 0 ) ( 200000 200000 )
Number of track patterns: 12
Number of DEF vias:       0
Number of components:     615
Number of terminals:      10
Number of snets:          2
Number of nets:           19

[INFO DRT-0167] List of default vias:
  Layer via
    default via: M1M2_PR
  Layer via2
    default via: M2M3_PR
  Layer via3
    default via: M3M4_PR
  Layer via4
    default via: M4M5_PR
[INFO DRT-0162] Library cell analysis.
[INFO DRT-0163] Instance analysis.
[INFO DRT-0164] Number of unique instances = 20.
[INFO DRT-0168] Init region query.
[INFO DRT-0024]   Complete FR_MASTERSLICE.
[INFO DRT-0024]   Complete licon.
[INFO DRT-0024]   Complete li1.
[INFO DRT-0024]   Complete mcon.
[INFO DRT-0024]   Complete met1.
[INFO DRT-0024]   Complete via.
[INFO DRT-0024]   Complete met2.
[INFO DRT-0024]   Complete via2.
[INFO DRT-0024]   Complete met3.
[INFO DRT-0024]   Complete via3.
[INFO DRT-0024]   Complete met4.
[INFO DRT-0024]   Complete via4.
[INFO DRT-0024]   Complete met5.
[INFO DRT-0033] FR_MASTERSLICE shape region query size = 0.
[INFO DRT-0033] licon shape region query size = 0.
[INFO DRT-0033] li1 shape region query size = 3159.
[INFO DRT-0033] mcon shape region query size = 0.
[INFO DRT-0033] met1 shape region query size = 1428.
[INFO DRT-0033] via shape region query size = 660.
[INFO DRT-0033] met2 shape region query size = 397.
[INFO DRT-0033] via2 shape region query size = 528.
[INFO DRT-0033] met3 shape region query size = 403.
[INFO DRT-0033] via3 shape region query size = 528.
[INFO DRT-0033] met4 shape region query size = 148.
[INFO DRT-0033] via4 shape region query size = 8.
[INFO DRT-0033] met5 shape region query size = 16.
[INFO DRT-0165] Start pin access.
[INFO DRT-0078]   Complete 41 pins.
[INFO DRT-0081]   Complete 14 unique inst patterns.
[INFO DRT-0084]   Complete 13 groups.
#scanned instances     = 615
#unique  instances     = 20
#stdCellGenAp          = 348
#stdCellValidPlanarAp  = 0
#stdCellValidViaAp     = 272
#stdCellPinNoAp        = 0
#stdCellPinCnt         = 44
#instTermValidViaApCnt = 0
#macroGenAp            = 0
#macroValidPlanarAp    = 0
#macroValidViaAp       = 0
#macroNoAp             = 0
[INFO DRT-0166] Complete pin access.
[INFO DRT-0267] cpu time = 00:00:04, elapsed time = 00:00:02, memory = 137.18 (MB), peak = 137.18 (MB)

[INFO DRT-0157] Number of guides:     103

[INFO DRT-0169] Post process guides.
[INFO DRT-0176] GCELLGRID X 0 DO 28 STEP 6900 ;
[INFO DRT-0177] GCELLGRID Y 0 DO 28 STEP 6900 ;
[INFO DRT-0028]   Complete FR_MASTERSLICE.
[INFO DRT-0028]   Complete licon.
[INFO DRT-0028]   Complete li1.
[INFO DRT-0028]   Complete mcon.
[INFO DRT-0028]   Complete met1.
[INFO DRT-0028]   Complete via.
[INFO DRT-0028]   Complete met2.
[INFO DRT-0028]   Complete via2.
[INFO DRT-0028]   Complete met3.
[INFO DRT-0028]   Complete via3.
[INFO DRT-0028]   Complete met4.
[INFO DRT-0028]   Complete via4.
[INFO DRT-0028]   Complete met5.
[INFO DRT-0178] Init guide query.
[INFO DRT-0035]   Complete FR_MASTERSLICE (guide).
[INFO DRT-0035]   Complete licon (guide).
[INFO DRT-0035]   Complete li1 (guide).
[INFO DRT-0035]   Complete mcon (guide).
[INFO DRT-0035]   Complete met1 (guide).
[INFO DRT-0035]   Complete via (guide).
[INFO DRT-0035]   Complete met2 (guide).
[INFO DRT-0035]   Complete via2 (guide).
[INFO DRT-0035]   Complete met3 (guide).
[INFO DRT-0035]   Complete via3 (guide).
[INFO DRT-0035]   Complete met4 (guide).
[INFO DRT-0035]   Complete via4 (guide).
[INFO DRT-0035]   Complete met5 (guide).
[INFO DRT-0036] FR_MASTERSLICE guide region query size = 0.
[INFO DRT-0036] licon guide region query size = 0.
[INFO DRT-0036] li1 guide region query size = 35.
[INFO DRT-0036] mcon guide region query size = 0.
[INFO DRT-0036] met1 guide region query size = 29.
[INFO DRT-0036] via guide region query size = 0.
[INFO DRT-0036] met2 guide region query size = 13.
[INFO DRT-0036] via2 guide region query size = 0.
[INFO DRT-0036] met3 guide region query size = 7.
[INFO DRT-0036] via3 guide region query size = 0.
[INFO DRT-0036] met4 guide region query size = 0.
[INFO DRT-0036] via4 guide region query size = 0.
[INFO DRT-0036] met5 guide region query size = 0.
[INFO DRT-0179] Init gr pin query.
[INFO DRT-0245] skipped writing guide updates to database.
[INFO DRT-0185] Post process initialize RPin region query.
[INFO DRT-0181] Start track assignment.
[INFO DRT-0184] Done with 48 vertical wires in 1 frboxes and 36 horizontal wires in 1 frboxes.
[INFO DRT-0186] Done with 0 vertical wires in 1 frboxes and 4 horizontal wires in 1 frboxes.
[INFO DRT-0182] Complete track assignment.
[INFO DRT-0267] cpu time = 00:00:00, elapsed time = 00:00:00, memory = 139.80 (MB), peak = 139.80 (MB)
[INFO DRT-0187] Start routing data preparation.
[INFO DRT-0267] cpu time = 00:00:00, elapsed time = 00:00:00, memory = 139.80 (MB), peak = 139.80 (MB)
[INFO DRT-0194] Start detail routing.
[INFO DRT-0195] Start 0th optimization iteration.
    Completing 10% with 0 violations.
    elapsed time = 00:00:00, memory = 140.18 (MB).
    Completing 20% with 0 violations.
    elapsed time = 00:00:00, memory = 141.70 (MB).
    Completing 30% with 2 violations.
    elapsed time = 00:00:00, memory = 141.70 (MB).
    Completing 40% with 2 violations.
    elapsed time = 00:00:00, memory = 148.57 (MB).
    Completing 50% with 2 violations.
    elapsed time = 00:00:00, memory = 148.57 (MB).
    Completing 60% with 2 violations.
    elapsed time = 00:00:00, memory = 148.57 (MB).
    Completing 70% with 2 violations.
    elapsed time = 00:00:00, memory = 149.78 (MB).
    Completing 80% with 3 violations.
    elapsed time = 00:00:00, memory = 149.78 (MB).
    Completing 90% with 3 violations.
    elapsed time = 00:00:00, memory = 157.28 (MB).
    Completing 100% with 4 violations.
    elapsed time = 00:00:00, memory = 157.28 (MB).
[INFO DRT-0199]   Number of violations = 5.
Viol/Layer        met1   met3
Metal Spacing        0      3
Recheck              1      0
Short                1      0
[INFO DRT-0267] cpu time = 00:00:02, elapsed time = 00:00:00, memory = 503.66 (MB), peak = 515.65 (MB)
Total wire length = 824 um.
Total wire length on LAYER li1 = 0 um.
Total wire length on LAYER met1 = 664 um.
Total wire length on LAYER met2 = 139 um.
Total wire length on LAYER met3 = 20 um.
Total wire length on LAYER met4 = 0 um.
Total wire length on LAYER met5 = 0 um.
Total number of vias = 86.
Up-via summary (total 86):

---------------------
 FR_MASTERSLICE     0
            li1    45
           met1    34
           met2     7
           met3     0
           met4     0
---------------------
                   86


[INFO DRT-0195] Start 1st optimization iteration.
    Completing 10% with 5 violations.
    elapsed time = 00:00:00, memory = 504.41 (MB).
    Completing 20% with 5 violations.
    elapsed time = 00:00:00, memory = 504.41 (MB).
    Completing 30% with 5 violations.
    elapsed time = 00:00:00, memory = 504.41 (MB).
    Completing 40% with 1 violations.
    elapsed time = 00:00:00, memory = 504.66 (MB).
    Completing 50% with 1 violations.
    elapsed time = 00:00:00, memory = 504.66 (MB).
    Completing 60% with 1 violations.
    elapsed time = 00:00:00, memory = 504.66 (MB).
    Completing 70% with 1 violations.
    elapsed time = 00:00:00, memory = 504.66 (MB).
    Completing 80% with 1 violations.
    elapsed time = 00:00:00, memory = 505.16 (MB).
    Completing 90% with 0 violations.
    elapsed time = 00:00:00, memory = 505.16 (MB).
    Completing 100% with 0 violations.
    elapsed time = 00:00:00, memory = 244.21 (MB).
[INFO DRT-0199]   Number of violations = 0.
[INFO DRT-0267] cpu time = 00:00:02, elapsed time = 00:00:01, memory = 517.08 (MB), peak = 517.08 (MB)
Total wire length = 816 um.
Total wire length on LAYER li1 = 0 um.
Total wire length on LAYER met1 = 656 um.
Total wire length on LAYER met2 = 134 um.
Total wire length on LAYER met3 = 25 um.
Total wire length on LAYER met4 = 0 um.
Total wire length on LAYER met5 = 0 um.
Total number of vias = 88.
Up-via summary (total 88):

---------------------
 FR_MASTERSLICE     0
            li1    45
           met1    36
           met2     7
           met3     0
           met4     0
---------------------
                   88


[INFO DRT-0198] Complete detail routing.
Total wire length = 816 um.
Total wire length on LAYER li1 = 0 um.
Total wire length on LAYER met1 = 656 um.
Total wire length on LAYER met2 = 134 um.
Total wire length on LAYER met3 = 25 um.
Total wire length on LAYER met4 = 0 um.
Total wire length on LAYER met5 = 0 um.
Total number of vias = 88.
Up-via summary (total 88):

---------------------
 FR_MASTERSLICE     0
            li1    45
           met1    36
           met2     7
           met3     0
           met4     0
---------------------
                   88


[INFO DRT-0267] cpu time = 00:00:04, elapsed time = 00:00:02, memory = 517.08 (MB), peak = 517.08 (MB)

[INFO DRT-0180] Post processing.
Setting global connections for newly added cells…
[INFO] Setting global connections...
Updating metrics…
Cell type report:                       Count       Area
  Fill cell                               130     487.97
  Tap cell                                469     586.81
  Antenna cell                              1       2.50
  Timing Repair Buffer                      8      55.05
  Inverter                                  1       3.75
  Multi-Input combinational cell            6      48.80
  Total                                   615    1184.89
Writing OpenROAD database to '/home/gmun/Downloads/2Bits2op/runs/e7_SARSA_nSteps_INDEPENDIENTES/71-openroad-detailedrouting/e7_SARSA_nSteps_INDEPENDIENTES.odb'…
Writing netlist to '/home/gmun/Downloads/2Bits2op/runs/e7_SARSA_nSteps_INDEPENDIENTES/71-openroad-detailedrouting/e7_SARSA_nSteps_INDEPENDIENTES.nl.v'…
Writing powered netlist to '/home/gmun/Downloads/2Bits2op/runs/e7_SARSA_nSteps_INDEPENDIENTES/71-openroad-detailedrouting/e7_SARSA_nSteps_INDEPENDIENTES.pnl.v'…
Writing layout to '/home/gmun/Downloads/2Bits2op/runs/e7_SARSA_nSteps_INDEPENDIENTES/71-openroad-detailedrouting/e7_SARSA_nSteps_INDEPENDIENTES.def'…
Writing timing constraints to '/home/gmun/Downloads/2Bits2op/runs/e7_SARSA_nSteps_INDEPENDIENTES/71-openroad-detailedrouting/e7_SARSA_nSteps_INDEPENDIENTES.sdc'…
