Reading OpenROAD database at '/home/gmun/Downloads/Sin_Corregir/runs/mult8_2bits_1op_e17306/61-openroad-globalrouting/mult8_2bits_1op_e17306.odb'…
Reading library file at '/home/gmun/.volare/volare/sky130/versions/0fe599b2afb6708d281543108caf8310912f54af/sky130A/libs.ref/sky130_fd_sc_hd/lib/sky130_fd_sc_hd__tt_025C_1v80.lib'…
Reading design constraints file at '/nix/store/ss2cw3sxbrwwx9jl0rrppbw4kgcmgi2n-python3-3.11.9-env/lib/python3.11/site-packages/openlane/scripts/base.sdc'…
[WARNING STA-0366] port '__VIRTUAL_CLK__' not found.
[INFO] Using clock __VIRTUAL_CLK__…
[INFO] Setting output delay to: 2
[INFO] Setting input delay to: 2
[WARNING STA-0366] port '__VIRTUAL_CLK__' not found.
[INFO] Setting load to: 0.033442
[INFO] Setting clock uncertainty to: 0.25
[INFO] Setting clock transition to: 0.1499999999999999944488848768742172978818416595458984375
[WARNING STA-0419] transition time can not be specified for virtual clocks.
[INFO] Setting timing derate to: 5%
[WARNING STA-0450] virtual clock __VIRTUAL_CLK__ can not be propagated.
[WARNING STA-0450] virtual clock __VIRTUAL_CLK__ can not be propagated.
[INFO] Setting signal min routing layer to: met1 and clock min routing layer to met1. 
[INFO] Setting signal max routing layer to: met5 and clock max routing layer to met5. 
-congestion_iterations 50 -verbose
[INFO GRT-0020] Min routing layer: met1
[INFO GRT-0021] Max routing layer: met5
[INFO GRT-0022] Global adjustment: 30%
[INFO GRT-0023] Grid origin: (0, 0)
[INFO GRT-0043] No OR_DEFAULT vias defined.
[INFO GRT-0088] Layer li1     Track-Pitch = 0.4600  line-2-Via Pitch: 0.3400
[INFO GRT-0088] Layer met1    Track-Pitch = 0.3400  line-2-Via Pitch: 0.3400
[INFO GRT-0088] Layer met2    Track-Pitch = 0.4600  line-2-Via Pitch: 0.3500
[INFO GRT-0088] Layer met3    Track-Pitch = 0.6800  line-2-Via Pitch: 0.6150
[INFO GRT-0088] Layer met4    Track-Pitch = 0.9200  line-2-Via Pitch: 1.0400
[INFO GRT-0088] Layer met5    Track-Pitch = 3.4000  line-2-Via Pitch: 3.1100
[INFO GRT-0019] Found 0 clock nets.
[INFO GRT-0001] Minimum degree: 2
[INFO GRT-0002] Maximum degree: 11
[INFO GRT-0003] Macros: 0
[INFO GRT-0043] No OR_DEFAULT vias defined.
[INFO GRT-0004] Blockages: 35

[INFO GRT-0053] Routing resources analysis:
          Routing      Original      Derated      Resource
Layer     Direction    Resources     Resources    Reduction (%)
---------------------------------------------------------------
li1        Vertical            0             0          0.00%
met1       Horizontal      16240          8017          50.63%
met2       Vertical        12152          7810          35.73%
met3       Horizontal       8120          5446          32.93%
met4       Vertical         4928          2977          39.59%
met5       Horizontal       1624           729          55.11%
---------------------------------------------------------------

[INFO GRT-0197] Via related to pin nodes: 1831
[INFO GRT-0198] Via related Steiner nodes: 30
[INFO GRT-0199] Via filling finished.
[INFO GRT-0111] Final number of vias: 2265
[INFO GRT-0112] Final usage 3D: 8002

[INFO GRT-0096] Final congestion report:
Layer         Resource        Demand        Usage (%)    Max H / Max V / Total Overflow
---------------------------------------------------------------------------------------
li1                  0             0            0.00%             0 /  0 /  0
met1              8017           638            7.96%             0 /  0 /  0
met2              7810           568            7.27%             0 /  0 /  0
met3              5446             1            0.02%             0 /  0 /  0
met4              2977             0            0.00%             0 /  0 /  0
met5               729             0            0.00%             0 /  0 /  0
---------------------------------------------------------------------------------------
Total            24979          1207            4.83%             0 /  0 /  0

[INFO GRT-0018] Total wirelength: 13586 um
[INFO GRT-0014] Routed nets: 352
[INFO GRT-0006] Repairing antennas, iteration 1.
[INFO GRT-0043] No OR_DEFAULT vias defined.
[INFO GRT-0012] Found 0 antenna violations.
Placement Analysis
---------------------------------
total displacement          0.0 u
average displacement        0.0 u
max displacement            0.0 u
original HPWL            7983.3 u
legalized HPWL           8218.0 u
delta HPWL                    3 %

[INFO DPL-0020] Mirrored 118 instances
[INFO DPL-0021] HPWL before            8218.0 u
[INFO DPL-0022] HPWL after             7983.3 u
[INFO DPL-0023] HPWL delta               -2.9 %
-congestion_iterations 50 -verbose
[INFO GRT-0020] Min routing layer: met1
[INFO GRT-0021] Max routing layer: met5
[INFO GRT-0022] Global adjustment: 30%
[INFO GRT-0023] Grid origin: (0, 0)
[INFO GRT-0043] No OR_DEFAULT vias defined.
[INFO GRT-0088] Layer li1     Track-Pitch = 0.4600  line-2-Via Pitch: 0.3400
[INFO GRT-0088] Layer met1    Track-Pitch = 0.3400  line-2-Via Pitch: 0.3400
[INFO GRT-0088] Layer met2    Track-Pitch = 0.4600  line-2-Via Pitch: 0.3500
[INFO GRT-0088] Layer met3    Track-Pitch = 0.6800  line-2-Via Pitch: 0.6150
[INFO GRT-0088] Layer met4    Track-Pitch = 0.9200  line-2-Via Pitch: 1.0400
[INFO GRT-0088] Layer met5    Track-Pitch = 3.4000  line-2-Via Pitch: 3.1100
[INFO GRT-0019] Found 0 clock nets.
[INFO GRT-0001] Minimum degree: 2
[INFO GRT-0002] Maximum degree: 11
[INFO GRT-0003] Macros: 0
[INFO GRT-0043] No OR_DEFAULT vias defined.
[INFO GRT-0004] Blockages: 35

[INFO GRT-0053] Routing resources analysis:
          Routing      Original      Derated      Resource
Layer     Direction    Resources     Resources    Reduction (%)
---------------------------------------------------------------
li1        Vertical            0             0          0.00%
met1       Horizontal      16240          8017          50.63%
met2       Vertical        12152          7810          35.73%
met3       Horizontal       8120          5446          32.93%
met4       Vertical         4928          2977          39.59%
met5       Horizontal       1624           729          55.11%
---------------------------------------------------------------

[INFO GRT-0197] Via related to pin nodes: 1831
[INFO GRT-0198] Via related Steiner nodes: 30
[INFO GRT-0199] Via filling finished.
[INFO GRT-0111] Final number of vias: 2265
[INFO GRT-0112] Final usage 3D: 8002

[INFO GRT-0096] Final congestion report:
Layer         Resource        Demand        Usage (%)    Max H / Max V / Total Overflow
---------------------------------------------------------------------------------------
li1                  0             0            0.00%             0 /  0 /  0
met1              8017           638            7.96%             0 /  0 /  0
met2              7810           568            7.27%             0 /  0 /  0
met3              5446             1            0.02%             0 /  0 /  0
met4              2977             0            0.00%             0 /  0 /  0
met5               729             0            0.00%             0 /  0 /  0
---------------------------------------------------------------------------------------
Total            24979          1207            4.83%             0 /  0 /  0

[INFO GRT-0018] Total wirelength: 13586 um
[INFO GRT-0014] Routed nets: 352
[INFO] Setting RC values…
Setting global connections for newly added cells…
[INFO] Setting global connections...
Updating metrics…
Cell type report:                       Count       Area
  Fill cell                               130     487.97
  Tap cell                                469     586.81
  Buffer                                    1       3.75
  Timing Repair Buffer                     90     746.97
  Inverter                                  5      18.77
  Multi-Input combinational cell          240    2015.68
  Total                                   935    3859.95
Writing OpenROAD database to '/home/gmun/Downloads/Sin_Corregir/runs/mult8_2bits_1op_e17306/64-openroad-repairantennas/1-diodeinsertion/mult8_2bits_1op_e17306.odb'…
Writing layout to '/home/gmun/Downloads/Sin_Corregir/runs/mult8_2bits_1op_e17306/64-openroad-repairantennas/1-diodeinsertion/mult8_2bits_1op_e17306.def'…
