Reading OpenROAD database at '/home/gmun/Downloads/2Bits2op/runs/SarsaNada_e8/71-openroad-globalrouting/SarsaNada_e8.odb'…
Reading library file at '/home/gmun/.volare/volare/sky130/versions/0fe599b2afb6708d281543108caf8310912f54af/sky130A/libs.ref/sky130_fd_sc_hd/lib/sky130_fd_sc_hd__tt_025C_1v80.lib'…
Reading design constraints file at '/nix/store/ss2cw3sxbrwwx9jl0rrppbw4kgcmgi2n-python3-3.11.9-env/lib/python3.11/site-packages/openlane/scripts/base.sdc'…
[WARNING STA-0366] port '__VIRTUAL_CLK__' not found.
[INFO] Using clock __VIRTUAL_CLK__…
[INFO] Setting output delay to: 2
[INFO] Setting input delay to: 2
[WARNING STA-0366] port '__VIRTUAL_CLK__' not found.
[INFO] Setting load to: 0.033442
[INFO] Setting clock uncertainty to: 0.25
[INFO] Setting clock transition to: 0.1499999999999999944488848768742172978818416595458984375
[WARNING STA-0419] transition time can not be specified for virtual clocks.
[INFO] Setting timing derate to: 5%
[WARNING STA-0450] virtual clock __VIRTUAL_CLK__ can not be propagated.
[WARNING STA-0450] virtual clock __VIRTUAL_CLK__ can not be propagated.
[INFO] Setting signal min routing layer to: met1 and clock min routing layer to met1. 
[INFO] Setting signal max routing layer to: met5 and clock max routing layer to met5. 
-congestion_iterations 50 -verbose
[INFO GRT-0020] Min routing layer: met1
[INFO GRT-0021] Max routing layer: met5
[INFO GRT-0022] Global adjustment: 30%
[INFO GRT-0023] Grid origin: (0, 0)
[INFO GRT-0043] No OR_DEFAULT vias defined.
[INFO GRT-0088] Layer li1     Track-Pitch = 0.4600  line-2-Via Pitch: 0.3400
[INFO GRT-0088] Layer met1    Track-Pitch = 0.3400  line-2-Via Pitch: 0.3400
[INFO GRT-0088] Layer met2    Track-Pitch = 0.4600  line-2-Via Pitch: 0.3500
[INFO GRT-0088] Layer met3    Track-Pitch = 0.6800  line-2-Via Pitch: 0.6150
[INFO GRT-0088] Layer met4    Track-Pitch = 0.9200  line-2-Via Pitch: 1.0400
[INFO GRT-0088] Layer met5    Track-Pitch = 3.4000  line-2-Via Pitch: 3.1100
[INFO GRT-0019] Found 0 clock nets.
[INFO GRT-0001] Minimum degree: 2
[INFO GRT-0002] Maximum degree: 4
[INFO GRT-0003] Macros: 0
[INFO GRT-0043] No OR_DEFAULT vias defined.
[INFO GRT-0004] Blockages: 0

[INFO GRT-0053] Routing resources analysis:
          Routing      Original      Derated      Resource
Layer     Direction    Resources     Resources    Reduction (%)
---------------------------------------------------------------
li1        Vertical            0             0          0.00%
met1       Horizontal      16240          8019          50.62%
met2       Vertical        12152          7810          35.73%
met3       Horizontal       8120          5446          32.93%
met4       Vertical         4928          2977          39.59%
met5       Horizontal       1624           729          55.11%
---------------------------------------------------------------

[INFO GRT-0197] Via related to pin nodes: 70
[INFO GRT-0198] Via related Steiner nodes: 0
[INFO GRT-0199] Via filling finished.
[INFO GRT-0111] Final number of vias: 86
[INFO GRT-0112] Final usage 3D: 354

[INFO GRT-0096] Final congestion report:
Layer         Resource        Demand        Usage (%)    Max H / Max V / Total Overflow
---------------------------------------------------------------------------------------
li1                  0             0            0.00%             0 /  0 /  0
met1              8019            83            1.04%             0 /  0 /  0
met2              7810            11            0.14%             0 /  0 /  0
met3              5446             2            0.04%             0 /  0 /  0
met4              2977             0            0.00%             0 /  0 /  0
met5               729             0            0.00%             0 /  0 /  0
---------------------------------------------------------------------------------------
Total            24981            96            0.38%             0 /  0 /  0

[INFO GRT-0018] Total wirelength: 834 um
[INFO GRT-0014] Routed nets: 18
[INFO GRT-0006] Repairing antennas, iteration 1.
[INFO GRT-0043] No OR_DEFAULT vias defined.
[INFO GRT-0012] Found 2 antenna violations.
[INFO GRT-0015] Inserted 2 diodes.
[INFO GRT-0009] rerouting 2 nets.
[INFO GRT-0001] Minimum degree: 3
[INFO GRT-0002] Maximum degree: 3
[INFO GRT-0006] Repairing antennas, iteration 2.
[INFO GRT-0043] No OR_DEFAULT vias defined.
[INFO GRT-0012] Found 0 antenna violations.
Placement Analysis
---------------------------------
total displacement          0.0 u
average displacement        0.0 u
max displacement            0.0 u
original HPWL             666.2 u
legalized HPWL            666.2 u
delta HPWL                    0 %

[INFO DPL-0020] Mirrored 6 instances
[INFO DPL-0021] HPWL before             666.2 u
[INFO DPL-0022] HPWL after              658.9 u
[INFO DPL-0023] HPWL delta               -1.1 %
-congestion_iterations 50 -verbose
[INFO GRT-0020] Min routing layer: met1
[INFO GRT-0021] Max routing layer: met5
[INFO GRT-0022] Global adjustment: 30%
[INFO GRT-0023] Grid origin: (0, 0)
[INFO GRT-0043] No OR_DEFAULT vias defined.
[INFO GRT-0088] Layer li1     Track-Pitch = 0.4600  line-2-Via Pitch: 0.3400
[INFO GRT-0088] Layer met1    Track-Pitch = 0.3400  line-2-Via Pitch: 0.3400
[INFO GRT-0088] Layer met2    Track-Pitch = 0.4600  line-2-Via Pitch: 0.3500
[INFO GRT-0088] Layer met3    Track-Pitch = 0.6800  line-2-Via Pitch: 0.6150
[INFO GRT-0088] Layer met4    Track-Pitch = 0.9200  line-2-Via Pitch: 1.0400
[INFO GRT-0088] Layer met5    Track-Pitch = 3.4000  line-2-Via Pitch: 3.1100
[INFO GRT-0019] Found 0 clock nets.
[INFO GRT-0001] Minimum degree: 2
[INFO GRT-0002] Maximum degree: 4
[INFO GRT-0003] Macros: 0
[INFO GRT-0043] No OR_DEFAULT vias defined.
[INFO GRT-0004] Blockages: 0

[INFO GRT-0053] Routing resources analysis:
          Routing      Original      Derated      Resource
Layer     Direction    Resources     Resources    Reduction (%)
---------------------------------------------------------------
li1        Vertical            0             0          0.00%
met1       Horizontal      16240          8019          50.62%
met2       Vertical        12152          7810          35.73%
met3       Horizontal       8120          5446          32.93%
met4       Vertical         4928          2977          39.59%
met5       Horizontal       1624           729          55.11%
---------------------------------------------------------------

[INFO GRT-0197] Via related to pin nodes: 72
[INFO GRT-0198] Via related Steiner nodes: 0
[INFO GRT-0199] Via filling finished.
[INFO GRT-0111] Final number of vias: 88
[INFO GRT-0112] Final usage 3D: 360

[INFO GRT-0096] Final congestion report:
Layer         Resource        Demand        Usage (%)    Max H / Max V / Total Overflow
---------------------------------------------------------------------------------------
li1                  0             0            0.00%             0 /  0 /  0
met1              8019            83            1.04%             0 /  0 /  0
met2              7810            11            0.14%             0 /  0 /  0
met3              5446             2            0.04%             0 /  0 /  0
met4              2977             0            0.00%             0 /  0 /  0
met5               729             0            0.00%             0 /  0 /  0
---------------------------------------------------------------------------------------
Total            24981            96            0.38%             0 /  0 /  0

[INFO GRT-0018] Total wirelength: 834 um
[INFO GRT-0014] Routed nets: 18
[INFO] Setting RC values…
Setting global connections for newly added cells…
[INFO] Setting global connections...
Updating metrics…
Cell type report:                       Count       Area
  Fill cell                               130     487.97
  Tap cell                                469     586.81
  Antenna cell                              2       5.00
  Buffer                                    1       5.00
  Timing Repair Buffer                      8      35.03
  Multi-Input combinational cell            5      33.78
  Total                                   615    1153.61
Writing OpenROAD database to '/home/gmun/Downloads/2Bits2op/runs/SarsaNada_e8/74-openroad-repairantennas/1-diodeinsertion/SarsaNada_e8.odb'…
Writing layout to '/home/gmun/Downloads/2Bits2op/runs/SarsaNada_e8/74-openroad-repairantennas/1-diodeinsertion/SarsaNada_e8.def'…
