Reading OpenROAD database at '/home/gmun/Downloads/8Bits_corrigiendo2op_2Bits/runs/SarsaNada_e10/64-openroad-repairantennas/1-diodeinsertion/SarsaNada_e10.odb'…
Reading library file at '/home/gmun/.volare/volare/sky130/versions/0fe599b2afb6708d281543108caf8310912f54af/sky130A/libs.ref/sky130_fd_sc_hd/lib/sky130_fd_sc_hd__tt_025C_1v80.lib'…
Reading design constraints file at '/nix/store/ss2cw3sxbrwwx9jl0rrppbw4kgcmgi2n-python3-3.11.9-env/lib/python3.11/site-packages/openlane/scripts/base.sdc'…
[WARNING STA-0366] port '__VIRTUAL_CLK__' not found.
[INFO] Using clock __VIRTUAL_CLK__…
[INFO] Setting output delay to: 2
[INFO] Setting input delay to: 2
[WARNING STA-0366] port '__VIRTUAL_CLK__' not found.
[INFO] Setting load to: 0.033442
[INFO] Setting clock uncertainty to: 0.25
[INFO] Setting clock transition to: 0.1499999999999999944488848768742172978818416595458984375
[WARNING STA-0419] transition time can not be specified for virtual clocks.
[INFO] Setting timing derate to: 5%
[WARNING STA-0450] virtual clock __VIRTUAL_CLK__ can not be propagated.
[INFO ORD-0030] Using 4 thread(s).
[INFO DRT-0149] Reading tech and libs.
[WARNING DRT-0349] LEF58_ENCLOSURE with no CUTCLASS is not supported. Skipping for layer mcon
[WARNING DRT-0349] LEF58_ENCLOSURE with no CUTCLASS is not supported. Skipping for layer mcon
[WARNING DRT-0349] LEF58_ENCLOSURE with no CUTCLASS is not supported. Skipping for layer via
[WARNING DRT-0349] LEF58_ENCLOSURE with no CUTCLASS is not supported. Skipping for layer via
[WARNING DRT-0349] LEF58_ENCLOSURE with no CUTCLASS is not supported. Skipping for layer via2
[WARNING DRT-0349] LEF58_ENCLOSURE with no CUTCLASS is not supported. Skipping for layer via2
[WARNING DRT-0349] LEF58_ENCLOSURE with no CUTCLASS is not supported. Skipping for layer via3
[WARNING DRT-0349] LEF58_ENCLOSURE with no CUTCLASS is not supported. Skipping for layer via3
[WARNING DRT-0349] LEF58_ENCLOSURE with no CUTCLASS is not supported. Skipping for layer via4
[WARNING DRT-0349] LEF58_ENCLOSURE with no CUTCLASS is not supported. Skipping for layer via4

Units:                1000
Number of layers:     13
Number of macros:     441
Number of vias:       29
Number of viarulegen: 25

[INFO DRT-0150] Reading design.

Design:                   SarsaNada_e10
Die area:                 ( 0 0 ) ( 200000 200000 )
Number of track patterns: 12
Number of DEF vias:       0
Number of components:     616
Number of terminals:      10
Number of snets:          2
Number of nets:           19

[INFO DRT-0167] List of default vias:
  Layer via
    default via: M1M2_PR
  Layer via2
    default via: M2M3_PR
  Layer via3
    default via: M3M4_PR
  Layer via4
    default via: M4M5_PR
[INFO DRT-0162] Library cell analysis.
[INFO DRT-0163] Instance analysis.
[INFO DRT-0164] Number of unique instances = 18.
[INFO DRT-0168] Init region query.
[INFO DRT-0024]   Complete FR_MASTERSLICE.
[INFO DRT-0024]   Complete licon.
[INFO DRT-0024]   Complete li1.
[INFO DRT-0024]   Complete mcon.
[INFO DRT-0024]   Complete met1.
[INFO DRT-0024]   Complete via.
[INFO DRT-0024]   Complete met2.
[INFO DRT-0024]   Complete via2.
[INFO DRT-0024]   Complete met3.
[INFO DRT-0024]   Complete via3.
[INFO DRT-0024]   Complete met4.
[INFO DRT-0024]   Complete via4.
[INFO DRT-0024]   Complete met5.
[INFO DRT-0033] FR_MASTERSLICE shape region query size = 0.
[INFO DRT-0033] licon shape region query size = 0.
[INFO DRT-0033] li1 shape region query size = 3115.
[INFO DRT-0033] mcon shape region query size = 0.
[INFO DRT-0033] met1 shape region query size = 1430.
[INFO DRT-0033] via shape region query size = 660.
[INFO DRT-0033] met2 shape region query size = 396.
[INFO DRT-0033] via2 shape region query size = 528.
[INFO DRT-0033] met3 shape region query size = 404.
[INFO DRT-0033] via3 shape region query size = 528.
[INFO DRT-0033] met4 shape region query size = 148.
[INFO DRT-0033] via4 shape region query size = 8.
[INFO DRT-0033] met5 shape region query size = 16.
[INFO DRT-0165] Start pin access.
[INFO DRT-0078]   Complete 33 pins.
[INFO DRT-0081]   Complete 12 unique inst patterns.
[INFO DRT-0084]   Complete 12 groups.
#scanned instances     = 616
#unique  instances     = 18
#stdCellGenAp          = 292
#stdCellValidPlanarAp  = 0
#stdCellValidViaAp     = 228
#stdCellPinNoAp        = 0
#stdCellPinCnt         = 42
#instTermValidViaApCnt = 0
#macroGenAp            = 0
#macroValidPlanarAp    = 0
#macroValidViaAp       = 0
#macroNoAp             = 0
[INFO DRT-0166] Complete pin access.
[INFO DRT-0267] cpu time = 00:00:05, elapsed time = 00:00:02, memory = 136.19 (MB), peak = 136.19 (MB)

[INFO DRT-0157] Number of guides:     95

[INFO DRT-0169] Post process guides.
[INFO DRT-0176] GCELLGRID X 0 DO 28 STEP 6900 ;
[INFO DRT-0177] GCELLGRID Y 0 DO 28 STEP 6900 ;
[INFO DRT-0028]   Complete FR_MASTERSLICE.
[INFO DRT-0028]   Complete licon.
[INFO DRT-0028]   Complete li1.
[INFO DRT-0028]   Complete mcon.
[INFO DRT-0028]   Complete met1.
[INFO DRT-0028]   Complete via.
[INFO DRT-0028]   Complete met2.
[INFO DRT-0028]   Complete via2.
[INFO DRT-0028]   Complete met3.
[INFO DRT-0028]   Complete via3.
[INFO DRT-0028]   Complete met4.
[INFO DRT-0028]   Complete via4.
[INFO DRT-0028]   Complete met5.
[INFO DRT-0178] Init guide query.
[INFO DRT-0035]   Complete FR_MASTERSLICE (guide).
[INFO DRT-0035]   Complete licon (guide).
[INFO DRT-0035]   Complete li1 (guide).
[INFO DRT-0035]   Complete mcon (guide).
[INFO DRT-0035]   Complete met1 (guide).
[INFO DRT-0035]   Complete via (guide).
[INFO DRT-0035]   Complete met2 (guide).
[INFO DRT-0035]   Complete via2 (guide).
[INFO DRT-0035]   Complete met3 (guide).
[INFO DRT-0035]   Complete via3 (guide).
[INFO DRT-0035]   Complete met4 (guide).
[INFO DRT-0035]   Complete via4 (guide).
[INFO DRT-0035]   Complete met5 (guide).
[INFO DRT-0036] FR_MASTERSLICE guide region query size = 0.
[INFO DRT-0036] licon guide region query size = 0.
[INFO DRT-0036] li1 guide region query size = 31.
[INFO DRT-0036] mcon guide region query size = 0.
[INFO DRT-0036] met1 guide region query size = 23.
[INFO DRT-0036] via guide region query size = 0.
[INFO DRT-0036] met2 guide region query size = 12.
[INFO DRT-0036] via2 guide region query size = 0.
[INFO DRT-0036] met3 guide region query size = 8.
[INFO DRT-0036] via3 guide region query size = 0.
[INFO DRT-0036] met4 guide region query size = 0.
[INFO DRT-0036] via4 guide region query size = 0.
[INFO DRT-0036] met5 guide region query size = 0.
[INFO DRT-0179] Init gr pin query.
[INFO DRT-0245] skipped writing guide updates to database.
[INFO DRT-0185] Post process initialize RPin region query.
[INFO DRT-0181] Start track assignment.
[INFO DRT-0184] Done with 43 vertical wires in 1 frboxes and 31 horizontal wires in 1 frboxes.
[INFO DRT-0186] Done with 0 vertical wires in 1 frboxes and 3 horizontal wires in 1 frboxes.
[INFO DRT-0182] Complete track assignment.
[INFO DRT-0267] cpu time = 00:00:00, elapsed time = 00:00:00, memory = 137.44 (MB), peak = 137.44 (MB)
[INFO DRT-0187] Start routing data preparation.
[INFO DRT-0267] cpu time = 00:00:00, elapsed time = 00:00:00, memory = 137.44 (MB), peak = 137.44 (MB)
[INFO DRT-0194] Start detail routing.
[INFO DRT-0195] Start 0th optimization iteration.
    Completing 10% with 0 violations.
    elapsed time = 00:00:00, memory = 137.81 (MB).
    Completing 20% with 0 violations.
    elapsed time = 00:00:00, memory = 140.02 (MB).
    Completing 30% with 5 violations.
    elapsed time = 00:00:00, memory = 140.02 (MB).
    Completing 40% with 5 violations.
    elapsed time = 00:00:00, memory = 147.27 (MB).
    Completing 50% with 5 violations.
    elapsed time = 00:00:00, memory = 148.02 (MB).
    Completing 60% with 6 violations.
    elapsed time = 00:00:00, memory = 148.02 (MB).
    Completing 70% with 6 violations.
    elapsed time = 00:00:00, memory = 157.02 (MB).
    Completing 80% with 6 violations.
    elapsed time = 00:00:00, memory = 157.02 (MB).
    Completing 90% with 6 violations.
    elapsed time = 00:00:00, memory = 164.77 (MB).
    Completing 100% with 8 violations.
    elapsed time = 00:00:00, memory = 164.77 (MB).
[INFO DRT-0199]   Number of violations = 8.
Viol/Layer        met1   met3
Metal Spacing        2      5
Short                1      0
[INFO DRT-0267] cpu time = 00:00:02, elapsed time = 00:00:00, memory = 507.50 (MB), peak = 519.39 (MB)
Total wire length = 833 um.
Total wire length on LAYER li1 = 0 um.
Total wire length on LAYER met1 = 757 um.
Total wire length on LAYER met2 = 52 um.
Total wire length on LAYER met3 = 23 um.
Total wire length on LAYER met4 = 0 um.
Total wire length on LAYER met5 = 0 um.
Total number of vias = 89.
Up-via summary (total 89):

---------------------
 FR_MASTERSLICE     0
            li1    44
           met1    37
           met2     8
           met3     0
           met4     0
---------------------
                   89


[INFO DRT-0195] Start 1st optimization iteration.
    Completing 10% with 8 violations.
    elapsed time = 00:00:00, memory = 507.50 (MB).
    Completing 20% with 8 violations.
    elapsed time = 00:00:00, memory = 507.50 (MB).
    Completing 30% with 8 violations.
    elapsed time = 00:00:00, memory = 508.00 (MB).
    Completing 40% with 0 violations.
    elapsed time = 00:00:00, memory = 508.25 (MB).
    Completing 50% with 0 violations.
    elapsed time = 00:00:00, memory = 508.25 (MB).
    Completing 60% with 0 violations.
    elapsed time = 00:00:00, memory = 508.25 (MB).
    Completing 70% with 0 violations.
    elapsed time = 00:00:00, memory = 508.25 (MB).
    Completing 80% with 0 violations.
    elapsed time = 00:00:00, memory = 508.25 (MB).
    Completing 90% with 0 violations.
    elapsed time = 00:00:00, memory = 508.25 (MB).
    Completing 100% with 0 violations.
    elapsed time = 00:00:00, memory = 247.27 (MB).
[INFO DRT-0199]   Number of violations = 0.
[INFO DRT-0267] cpu time = 00:00:01, elapsed time = 00:00:00, memory = 520.27 (MB), peak = 520.27 (MB)
Total wire length = 829 um.
Total wire length on LAYER li1 = 0 um.
Total wire length on LAYER met1 = 755 um.
Total wire length on LAYER met2 = 46 um.
Total wire length on LAYER met3 = 26 um.
Total wire length on LAYER met4 = 0 um.
Total wire length on LAYER met5 = 0 um.
Total number of vias = 88.
Up-via summary (total 88):

---------------------
 FR_MASTERSLICE     0
            li1    44
           met1    36
           met2     8
           met3     0
           met4     0
---------------------
                   88


[INFO DRT-0198] Complete detail routing.
Total wire length = 829 um.
Total wire length on LAYER li1 = 0 um.
Total wire length on LAYER met1 = 755 um.
Total wire length on LAYER met2 = 46 um.
Total wire length on LAYER met3 = 26 um.
Total wire length on LAYER met4 = 0 um.
Total wire length on LAYER met5 = 0 um.
Total number of vias = 88.
Up-via summary (total 88):

---------------------
 FR_MASTERSLICE     0
            li1    44
           met1    36
           met2     8
           met3     0
           met4     0
---------------------
                   88


[INFO DRT-0267] cpu time = 00:00:04, elapsed time = 00:00:01, memory = 520.27 (MB), peak = 520.27 (MB)

[INFO DRT-0180] Post processing.
Setting global connections for newly added cells…
[INFO] Setting global connections...
Updating metrics…
Cell type report:                       Count       Area
  Fill cell                               130     487.97
  Tap cell                                469     586.81
  Antenna cell                              2       5.00
  Timing Repair Buffer                      8      52.55
  Multi-Input combinational cell            7      36.28
  Total                                   616    1168.62
Writing OpenROAD database to '/home/gmun/Downloads/8Bits_corrigiendo2op_2Bits/runs/SarsaNada_e10/66-openroad-detailedrouting/SarsaNada_e10.odb'…
Writing netlist to '/home/gmun/Downloads/8Bits_corrigiendo2op_2Bits/runs/SarsaNada_e10/66-openroad-detailedrouting/SarsaNada_e10.nl.v'…
Writing powered netlist to '/home/gmun/Downloads/8Bits_corrigiendo2op_2Bits/runs/SarsaNada_e10/66-openroad-detailedrouting/SarsaNada_e10.pnl.v'…
Writing layout to '/home/gmun/Downloads/8Bits_corrigiendo2op_2Bits/runs/SarsaNada_e10/66-openroad-detailedrouting/SarsaNada_e10.def'…
Writing timing constraints to '/home/gmun/Downloads/8Bits_corrigiendo2op_2Bits/runs/SarsaNada_e10/66-openroad-detailedrouting/SarsaNada_e10.sdc'…
